cp_id,cp_state,district_id,address_en,address2_en,address_tc,address2_tc,address_sc,address2_sc,lat,lgt,waste_type
"1291","Accepted","Sai_Kung","Tai Tan fiberglass refuse collection point at Tai Tan ","","大灘纖維站，大灘 ","","大滩纤维站，大滩","","22.436323","114.331299","Metals,Paper,Plastics"
"1292","Accepted","Sai_Kung","Hoi Ha Road fiberglass refuse collection point at Hoi Ha Road ","","海下路纖維站，海下路 ","","海下路纤维站，海下路","","22.459165","114.326345","Metals,Paper,Plastics"
"1293","Accepted","Sai_Kung","Mau Po fiberglass refuse collection point (SK-430) at Mau Po","","茅莆纖維站 (SK-430)，茅莆 ","","茅莆纤维站 (SK-430)，茅莆","","22.301128","114.294312","Metals,Paper,Plastics"
"1294","Accepted","Sai_Kung","Pak Kong Au Road Fiberglass RCP (SK-431) at Pak Kong Au Road ","","北港凹路纖維站 (SK-431)，北港凹路 ","","北港凹路纤维站 (SK-431)，北港凹路","","22.383022","114.262796","Metals,Paper,Plastics"
"1295","Accepted","Sai_Kung","At side of bin site at Leung Fai Tin Upper Road near Clear Water Bay Road, Sai Kung","","西貢兩塊田上路近清水灣道桶站旁","","西贡两块田上路近清水湾道桶站旁","","22.302299","114.286319","Metals,Paper,Plastics"
"1296","Accepted","Sai_Kung","Junction of Ho Chung Road and access to Wang Che Village (oppsite to Wang Che bin-site near Notice board) ","","蠔涌路與通往橫輋村道路交界(橫輋桶站對面近告示牌)","","蚝涌路与通往横輋村道路交界(横輋桶站对面近告示牌)","","22.356005","114.239858","Metals,Paper,Plastics"
"1297","Accepted","Sai_Kung","Refuse Collection Point at Clear Water Bay 2nd Beach, Sai Kung ","","西貢清水灣二灘垃圾站","","西贡清水湾二滩垃圾站","","22.288044","114.286609","Metals,Paper,Plastics"
"1298","Accepted","Sai_Kung","Sai O Village, Sai Sha Road, Sai Kung (near Lamp Post No. EB7664)","","西沙路西澳村(近燈柱編號 EB7664)","","西沙路西澳村(近灯柱编号 EB7664)","","22.430621","114.254298","Metals,Paper,Plastics"
"1299","Accepted","Sai_Kung","Near Lake View Villa, Silver Star Path, Silverstrand Beach Road, Sai Kung","","西貢銀綫灣道銀星徑近湖景別墅","","西贡银线湾道银星径近湖景别墅","","22.324080","114.270916","Metals,Paper,Plastics"
"1300","Accepted","Sai_Kung","Near Lamppost V0948, Pan Long Wan Road, Pan Long Wan, Sai Kung","","西貢檳榔灣檳榔灣道近燈柱編號 V0948","","西贡槟榔湾槟榔湾道近灯柱编号 V0948","","22.314458","114.285148","Metals,Paper,Plastics"
"1301","Accepted","Sai_Kung","Razor Hill Road near Lamp Post No. EB 0366, Sai Kung","","西貢碧翠路近電燈柱EB 0366","","西贡碧翠路近电灯柱EB 0366","","22.339324","114.247735","Metals,Paper,Plastics"
"1302","Accepted","Sai_Kung","Nin Fung Road near Lamp Post No. BE 1478","","年豐路近電燈柱BE 1478","","年丰路近电灯柱BE 1478","","22.429444","114.249444","Metals,Paper,Plastics"
"1304","Accepted","Sai_Kung","Near bin site opposite to Lamp Post No. EV1105 at Tan Shan Road, Sai Kung","","西貢炭山路電燈柱EV1105對面近垃圾箱位","","西贡炭山路电灯柱EV1105对面近垃圾箱位","","22.332769","114.235806","Metals,Paper,Plastics"
"1305","Accepted","Sai_Kung","G/F (Outside Entrance Lift Lobby) Sai Kung Tseung Kwan O Government Complex. 38 Pui Shing Road. Tseung Kwan O. N.T.","","新界西貢將軍澳培成路38號西貢將軍澳政府綜合大樓地下(大堂側)","","新界西贡将军澳培成路38号西贡将军澳政府综合大楼地下(大堂侧)","","22.317481","114.267914","Metals,Paper,Plastics"
"1306","Accepted","Sai_Kung","Beside the Bin Site at junction of Nam Shan Lane/Po Lo Che Road near Lamp Pole No. EA0043","","南山里/菠蘿輋路交界桶站旁近橙柱編號EA0043","","南山里/菠萝輋路交界桶站旁近橙柱编号EA0043","","22.389335","114.260579","Metals,Paper,Plastics"
"1307","Accepted","Sai_Kung","Yi Chun Street Refuse Collection Point","","宜春街垃圾站","","宜春街垃圾站","","22.380263","114.272127","Metals,Paper,Plastics"
"1308","Accepted","Sai_Kung","Tsueng Kwan O South Promenade, Near LOHAS Park Road, Lamp Pole DE 2321","","將軍澳南海濱長廊近康城路燈柱編號DE 2321","","将军澳南海滨长廊近康城路灯柱编号DE 2321","","22.296158","114.267144","Metals,Paper,Plastics"
"1309","Accepted","Sai_Kung","Tseung Kwan O South Promenade beside Po Yap Road, Near Wan Poon Path, Lamp pole BE 4604","","將軍澳南海濱長廊近灣畔徑與寶邑路燈柱編號BE 4604","","将军澳南海滨长廊近湾畔径与宝邑路灯柱编号BE 4604","","22.308011","114.264196","Metals,Paper,Plastics"
"1311","Accepted","Tsuen_Wan","Yau Kam Tau Village Refuse Collection Point (TW42)","","油柑頭村垃圾收集站(TW42)","","油柑头村垃圾收集站(TW42)","","22.372260","114.096753","Metals,Paper,Plastics"
"1312","Accepted","Tsuen_Wan","Tsuen Wan Market North (between Tsuen Wan Market Street & Chuen Lung Street)","","荃灣街市北 (街市街與川龍街交界)","","荃湾街市北 (街市街与川龙街交界)","","22.371752","114.116894","Metals,Paper,Plastics"
"1313","Accepted","Tsuen_Wan","Luen Yan Street Refuse Collection Point","","聯仁街垃圾收集站","","联仁街垃圾收集站","","22.367985","114.117930","Metals,Paper,Plastics"
"1314","Accepted","Tsuen_Wan","Refuse Collection Point at Chak Yan Road at Penny's Bay, Chak Yan Road at Penny's Bay, Tsuen Wan","","荃灣竹篙灣澤欣路竹篙灣澤欣路垃圾收集站","","荃湾竹篙湾泽欣路竹篙湾泽欣路垃圾收集站","","22.318240","114.040126","Metals,Paper,Plastics"
"1315","Accepted","Tsuen_Wan","Hoi Hing Road Refuse Collection Point, No. 23 Hoi Hing Road, Tsuen Wan","","荃灣海興路 23 號, 海興路垃圾收集站","","荃湾海兴路 23 号, 海兴路垃圾收集站","","22.371011","114.107584","Metals,Paper,Plastics"
"1316","Accepted","Tsuen_Wan","Tung Wo Street Refuse Collection Point (TW22)","","同和街垃圾收集站(TW22)","","同和街垃圾收集站(TW22)","","22.378991","114.125880","Metals,Paper,Plastics"
"1317","Accepted","Tsuen_Wan","Tung Wo Street Refuse Collection Point (TW23)","","同和街垃圾收集站(TW23)","","同和街垃圾收集站(TW23)","","22.379177","114.125502","Metals,Paper,Plastics"
"1318","Accepted","Tsuen_Wan","Chuen Lung Village Refuse Collection Point (TW40)","","川龍村垃圾收集站(TW40)","","川龙村垃圾收集站(TW40)","","22.394952","114.107231","Metals,Paper,Plastics"
"1319","Accepted","Tsuen_Wan","Heung Che Street Refuse Collection Point","","香車街垃圾收集站","","香车街垃圾收集站","","22.373581","114.111407","Metals,Paper,Plastics"
"1320","Accepted","Tsuen_Wan","Sham Tseng East Village Refuse Collection Point (TW54)","","深井東村垃圾收集站(TW54)","","深井东村垃圾收集站(TW54)","","22.366616","114.063932","Metals,Paper,Plastics"
"1321","Accepted","Tsuen_Wan","Lung Yue Road Refuse Collection Point (TW66)","","龍如路垃圾收集站(TW66)","","龙如路垃圾收集站(TW66)","","22.363469","114.046167","Metals,Paper,Plastics"
"1322","Accepted","Tsuen_Wan","Yau Ma Hom Road Refuse Collection Point (TW9)","","油麻磡路垃圾收集站(TW9)","","油麻磡路垃圾收集站(TW9)","","22.372301","114.131639","Metals,Paper,Plastics"
"1323","Accepted","Tsuen_Wan","Yeung Uk Road, outsdie Tsuen Wan Park","","楊屋道，荃灣公園外","","杨屋道，荃湾公园外","","22.368650","114.114003","Metals,Paper,Plastics"
"1324","Accepted","Tsuen_Wan","Tak Wah Street, outside Tak Wah Park","","德華街，德華公園外","","德华街，德华公园外","","22.370546","114.119358","Metals,Paper,Plastics"
"1325","Accepted","Tsuen_Wan","Sheung Kwai Chung Village Junk Collection Point (TW12)","","上葵涌村廢物收集站(TW12)","","上葵涌村废物收集站(TW12)","","22.374981","114.134323","Metals,Paper,Plastics"
"1326","Accepted","Tsuen_Wan","Sheung Kwai Chung Village (Fibre-glass) Refuse Collection Point (TW13)","","上葵涌村(纖維)垃圾收集站(TW13)","","上葵涌村(纤维)垃圾收集站(TW13)","","22.374871","114.133505","Metals,Paper,Plastics"
"1328","Accepted","Tsuen_Wan","Sitting-out Area near Nam Fung Centre Bus Terminus","","南豐中心巴士總站旁的休憩處","","南丰中心巴士总站旁的休憩处","","22.373464","114.116753","Metals,Paper,Plastics"
"1329","Accepted","Tsuen_Wan","Tsuen Wan Market Street Refuse Collection Point, Tsuen Wan Market Street (Opposite to No. 150), Tsuen Wan.","","荃灣街市街（150號對面）荃灣街市街垃圾收集站","","荃湾街市街（150号对面）荃湾街市街垃圾收集站","","22.370090","114.120746","Metals,Paper,Plastics"
"1330","Accepted","Tsuen_Wan","Pavement of Mei Wan Street outside Discovery Park","","美環街愉景新城外行人路","","美环街愉景新城外行人路","","22.377012","114.111166","Metals,Paper,Plastics"
"1331","Accepted","Tsuen_Wan","Pavement outside Tsuen Wan Plaza (At junction of Yuen Tun Circuit and Hoi Shung Road)","","荃灣廣場外行人路(圓墩圍與海盛路交界)","","荃湾广场外行人路(圆墩围与海盛路交界)荃湾广场外行人路(圆墩围与海盛路交界)","","22.370170","114.111354","Metals,Paper,Plastics"
"1332","Accepted","Tsuen_Wan","Tsuen Wan MTR (near Multi-storey Carpark Building )","","港鐵荃灣站(近多層停車場大廈)","","港铁荃湾站(近多层停车场大厦)","","22.372723","114.119232","Metals,Paper,Plastics"
"1333","Accepted","Tsuen_Wan","Tsuen Wan MTR Station (Tai Ho Road near Red Cross Blood Donation Centre)","","港鐵荃灣站(近大河道紅十字會捐血中心)","","港铁荃湾站(近大河道红十字会捐血中心)","","22.373165","114.116691","Metals,Paper,Plastics"
"1334","Accepted","Tsuen_Wan","Castle Peak Road near House No.189 junction of Tai Ho Road","","大河道近青山道189號","","大河道近青山道189号","","22.372301","114.118182","Metals,Paper,Plastics"
"1335","Accepted","Tsuen_Wan","Passage-way between Sai Lau Kok Garden & Fou Wah Centre","","西樓角公園與富華中心之間通道","","西楼角公园与富华中心之间通道","","22.373174","114.118269","Metals,Paper,Plastics"
"1336","Accepted","Tsuen_Wan","Outside Block 1, Tsuen Kam Centre, Sai Lau Kok Road","","西樓角路荃錦中心第一座外","","西楼角路荃锦中心第一座外","","22.374350","114.114432","Metals,Paper,Plastics"
"1337","Accepted","Tsuen_Wan","Fu Yung Street (adjacent to footbridge)","","芙蓉街，行人天橋旁","","芙蓉街，行人天桥旁","","22.372683","114.110671","Metals,Paper,Plastics"
"1339","Accepted","Tsuen_Wan","Opposite to 180, Yau Ma Hom Road","","油麻磡路180號對面","","油麻磡路180号对面","","22.371458","114.134340","Metals,Paper,Plastics"
"1340","Accepted","Tsuen_Wan","Princess Alexandra Community Centre, 60 Tai Ho Road","","雅麗珊社區中心, 大河道60號","","雅丽珊小区中心, 大河道60号","","22.371999","114.114748","Metals,Paper,Plastics"
"1341","Accepted","Tsuen_Wan","Tung Po Tor Refuse Collection Point (TW-15) (Lo Wai Road, Near Car park)","","東普陀垃圾收集站(TW-15),(老圍路停車場)","","东普陀垃圾收集站(TW-15),(老围路停车场)","","22.380241","114.127486","Metals,Paper,Plastics"
"1342","Accepted","Tsuen_Wan","Ma Wan Refuse Collection Point 1 (TW81)","","馬灣一站，垃圾收集站 (TW81)","","马湾一站，垃圾收集站 (TW81)","","22.351758","114.058675","Metals,Paper,Plastics"
"1343","Accepted","Tsuen_Wan","Ho Pui Tsuen Pai Lau, Ting Kok Street","","定國街，河背村牌樓","","定国街，河背村牌楼","","22.371554","114.125417","Metals,Paper,Plastics"
"1344","Accepted","Tsuen_Wan","Outside East Asia Garden, Texaco Road","","德士古道東亞花園外 ","","德士古道东亚花园外","","22.368001","114.121704","Metals,Paper,Plastics"
"1345","Accepted","Tsuen_Wan","Next to Sam Tung Uk Resite Village Refuse Collection Point(RCP), Tsuen Wan","","荃灣三棟屋村垃圾收集圾站側","","荃湾三栋屋村垃圾收集圾站侧","","22.380047","114.131542","Metals,Paper,Plastics"
"1346","Accepted","Tsuen_Wan","Castle Road – Ting Kau RCP (TW-50)","","青山公路汀九段垃圾站 (TW-50)","","青山公路汀九段垃圾站 (TW-50)","","22.370208","114.080583","Metals,Paper,Plastics"
"1348","Accepted","Tsuen_Wan","Sham Tseng Village Refuse Collection Point (TW-63) Sham Tseng Tsuen Road","","深井村路深井村垃圾站 (TW-63)","","深井村路深井村垃圾站 (TW-63)","","22.368103","114.057921","Metals,Paper,Plastics"
"1349","Accepted","Tsuen_Wan","Lei Shu Road, Lei Muk Shue Estate Refuse Collection Point (TW-10)","","梨木樹邨梨樹路垃圾站 (TW-10)","","梨木树邨梨树路垃圾站 (TW-10)","","22.376349","114.135193","Metals,Paper,Plastics"
"1350","Accepted","Tsuen_Wan","Fu Yung Shan San Tsuen RCP (TW34), Fu Yung Shan, Tsuen Wan","","荃灣芙蓉山芙蓉山新村垃圾收集站 (TW34)","","荃湾芙蓉山芙蓉山新村垃圾收集站 (TW34)","","22.378914","114.122892","Metals,Paper,Plastics"
"1351","Accepted","Tsuen_Wan","Ma Wan RCP (TW85), Ma Wan Main Street Village South, Ma Wan","","馬灣馬灣大街村南垃圾收集站 (TW85)","","马湾马湾大街村南垃圾收集站 (TW85)","","22.351603","114.058718","Metals,Paper,Plastics"
"1352","Accepted","Tsuen_Wan","Outside Chai Wan Kok Public Toilet","","柴灣角公廁外","","柴湾角公厕外","","22.374361","114.105719","Metals,Paper,Plastics"
"1353","Accepted","Tsuen_Wan","Outside Wang Lung Street Public Toilet","","橫龍街公廁外","","横龙街公厕外","","22.365352","114.118682","Metals,Paper,Plastics"
"1354","Accepted","Tsuen_Wan","Outside Lo Wai Road Public Toilet at Lo Wai Road","","老圍路老圍路公廁外","","老围路老围路公厕外","","22.380360","114.128222","Metals,Paper,Plastics"
"1355","Accepted","Tsuen_Wan","Outside Tai Ho Road Public Toilet at Tai Ho Road","","大河道大河道公廁外","","大河道大河道公厕外","","22.366795","114.111178","Metals,Paper,Plastics"
"1356","Accepted","Tsuen_Wan","Kin Ming Street, Lo Tak Court","","建明街路德圍","","建明街路德围","","22.373269","114.115296","Metals,Paper,Plastics"
"1358","Accepted","Tsuen_Wan","No. 1 Wang Wo Tsai Street, Tsuen Wan (Near Lamp Post No. FA1777)","","荃灣橫窩仔街１號(近燈柱編號 FA1777)","","荃湾横窝仔街１号(近灯柱编号 FA1777)","","22.367417","114.118094","Metals,Paper,Plastics"
"1359","Accepted","Tsuen_Wan","Outside Nam Fung Centre at Castle Peak Road","","青山公路南豐中心外","","青山公路南丰中心外","","22.373621","114.116294","Metals,Paper,Plastics"
"1360","Accepted","Tsuen_Wan","Outside Kowloon Panda Hotel at Kwan Mun Hau Street","","關門口街九龍悅來酒店外","","关门口街九龙悦来酒店外","","22.369404","114.121132","Metals,Paper,Plastics"
"1361","Accepted","Tsuen_Wan","Bus Stop at Tai Ho Road North Flyover (to Tsuen Wan)","","大河道北天橋巴士站 (向荃灣方向)","","大河道北天桥巴士站 (向荃湾方向)","","22.373850","114.117775","Metals,Paper,Plastics"
"1362","Accepted","Tsuen_Wan","Bus Stop at Tai Ho Road North Flyover (to Sha Tin)","","大河道北天橋巴士站 (向沙田方向)","","大河道北天桥巴士站 (向沙田方向)","","22.374126","114.117756","Metals,Paper,Plastics"
"1363","Accepted","Tsuen_Wan","Bus Terminus, Allway Gardens","","荃威花園巴士總站 ","","荃威花园巴士总站","","22.377173","114.104269","Metals,Paper,Plastics"
"1364","Accepted","Tsuen_Wan","Hoi Pai Resite Village RCP (TW-20) at Hoi Pai Resite Village","","海壩村垃圾站 (TW-20)，海壩村","","海坝村垃圾站 (TW-20)，海坝村","","22.378507","114.127194","Metals,Paper,Plastics"
"1365","Accepted","Tsuen_Wan","Hoi Pa Village Northeast Terrace RCP (TW-26)","","海壩村東北台垃圾站 (TW-26)","","海坝村东北台垃圾站 (TW-26)","","22.377153","114.123195","Metals,Paper,Plastics"
"1366","Accepted","Tsuen_Wan","Muk Min Ha RCP (TW-28) at Muk Min Ha Resite Village","","木錦下村垃圾站 (TW-28)，木錦下村","","木锦下村垃圾站 (TW-28)，木锦下村","","22.376540","114.117377","Metals,Paper,Plastics"
"1367","Accepted","Tsuen_Wan","Pak Tin Pa Village RCP (TW-25) at Pak Tin Pa Resite Village","","白田霸村垃圾站 (TW-25)，白田霸村","","白田霸村垃圾站 (TW-25)，白田霸村","","22.376681","114.120976","Metals,Paper,Plastics"
"1368","Accepted","Tsuen_Wan","Ting Fung Street RCP (TW-6) at Ting Fung Street","","定豐街垃圾站 (TW-6)，定豐街","","定丰街垃圾站 (TW-6)，定丰街","","22.371899","114.127789","Metals,Paper,Plastics"
"1369","Accepted","Tsuen_Wan","Yuen Yuen Institute RCP (TW-18) at Yuen Yuen Institute, Lo Wai Road, ","","圓玄學院垃圾站 (TW-18)，老圍路圓玄學院","","圆玄学院垃圾站 (TW-18)，老围路圆玄学院","","22.382736","114.123688","Metals,Paper,Plastics"
"1370","Accepted","Tsuen_Wan","Gemini Beach RCP (TW-53) opposite to Gemini Beach","","雙仙灣垃圾站 (TW-53)，雙仙灣對面","","双仙湾垃圾站 (TW-53)，双仙湾对面","","22.364143","114.068421","Metals,Paper,Plastics"
"1371","Accepted","Tsuen_Wan","Hoi Pa South Platform RCP (TW-24) at Ma Sin Pei Road, Hoi Pai South Platform Village","","海壩南台垃圾站 (TW-24)，海壩南台重建村，馬閃排路","","海坝南台垃圾站 (TW-24)，海坝南台重建村，马闪排路","","22.376245","114.120552","Metals,Paper,Plastics"
"1372","Accepted","Tsuen_Wan","Ka Lung Village RCP (TW-70) at Ka Lung Village","","嘉龍村垃圾站 (TW-70)，青山道嘉龍村","","嘉龙村垃圾站 (TW-70)，青山道嘉龙村","","22.356458","114.032218","Metals,Paper,Plastics"
"1373","Accepted","Tsuen_Wan","Kwong Pan Tin RCP-1 (TW-35) at Kwong Pan Tin","","光板田村一站 (TW-35)，荃錦公路近光板田村","","光板田村一站 (TW-35)，荃锦公路近光板田村","","22.377726","114.113465","Metals,Paper,Plastics"
"1374","Accepted","Tsuen_Wan","Kwong Pan Tin RCP-2 (TW-36) at Section 3, Kwong Pan Tin","","光板田村二站 (TW-36)，荃錦公路近光板田村福利會","","光板田村二站 (TW-36)，荃锦公路近光板田村福利会","","22.379271","114.112806","Metals,Paper,Plastics"
"1375","Accepted","Tsuen_Wan","Ma Sin Pai JCP (TW-27) at Ma Sin Pai Road","","馬閃排路垃圾站 (TW-27)，荃錦公路馬閃排路","","马闪排路垃圾站 (TW-27)，荃锦公路马闪排路","","22.377391","114.123303","Metals,Paper,Plastics"
"1376","Accepted","Tsuen_Wan","Po Kwong Yuen RCP (TW-16) at Po Kwong Yuen Hill Top Road","","普光園垃圾站 (TW-16)，普光園顯達路","","普光园垃圾站 (TW-16)，普光园显达路","","22.380620","114.128776","Metals,Paper,Plastics"
"1377","Accepted","Tsuen_Wan","Seaview Villa RCP (TW-48) at 38 Castle Peak Road","","海景別墅垃圾站 (TW-48)，青山道38號","","海景别墅垃圾站 (TW-48)，青山道38号","","22.369754","114.081505","Metals,Paper,Plastics"
"1378","Accepted","Tsuen_Wan","Wo Yi Hop RCP (TW-14) at Shing Mun Lane, Wo Yi Hop Village","","和宜合道垃圾站 (TW-14)，城門路和宜合村","","和宜合道垃圾站 (TW-14)，城门路和宜合村","","22.382361","114.138195","Metals,Paper,Plastics"
"1379","Accepted","Tsuen_Wan","Shing Mun Road RCP (TW-82) at Shing Mun Road","","城門道垃圾站 (TW-82)，城門道","","城门道垃圾站 (TW-82)，城门道","","22.382833","114.140016","Metals,Paper,Plastics"
"1380","Accepted","Tsuen_Wan","Ma Wan RCP 2 (TW-83) at Ma Wan Heuing Sze Wui Road","","馬灣二站垃圾收集站 (TW-83)，馬灣鄉事會路二號","","马湾二站垃圾收集站 (TW-83)，马湾乡事会路二号","","22.353187","114.059216","Metals,Paper,Plastics"
"1381","Accepted","Tsuen_Wan","Sheung Kwai Chung Tsuen RCP (TW-11) at Fai Chi Road","","上葵涌村垃圾站 (TW-11)，筷子路","","上葵涌村垃圾站 (TW-11)，筷子路","","22.375027","114.134310","Metals,Paper,Plastics"
"1382","Accepted","Tsuen_Wan","Bayside Villas RCP (TW-69) at Castle Peak RoadDragon View Villa RCP (TW-69) at Castle Peak Road","","龍景別墅垃圾站 (TW-69)，青山道","","龙景别墅垃圾站 (TW-69)，青山道","","22.357882","114.035681","Metals,Paper,Plastics"
"1383","Accepted","Tsuen_Wan","Lo Wai Village RCP-A (TW-17) at Lo Wai Road","","老圍路明發士多垃圾站 (TW-17)，老圍路近明發士多","","老围路明发士多垃圾站 (TW-17)，老围路近明发士多","","22.380369","114.125467","Metals,Paper,Plastics"
"1384","Accepted","Tsuen_Wan","Lo Wai Village RCP-A (TW-21) at Tung Wo Road near Yi Pei Chun Road","","同和路一站 (TW-21)，同和路近二坡圳路","","同和路一站 (TW-21)，同和路近二坡圳路","","22.378611","114.126350","Metals,Paper,Plastics"
"1387","Accepted","Tsuen_Wan","Fu Yung Shan Tsuen RCP (TW-31) at Fu Yung Shan Road near Chuk Lam Sim Monastery","","芙蓉山村垃圾站 (TW-31)，芙蓉山路近竹林襌院","","芙蓉山村垃圾站 (TW-31)，芙蓉山路近竹林襌院","","22.377034","114.118246","Metals,Paper,Plastics"
"1388","Accepted","Tsuen_Wan","Tai Kiu Village RCP (TW-38) at Tai Kiu Village, Route Twist","","大橋村垃圾站 (TW-38)，荃錦公路大橋村側","","大桥村垃圾站 (TW-38)，荃锦公路大桥村侧","","22.391825","114.104240","Metals,Paper,Plastics"
"1389","Accepted","Tsuen_Wan","Approach Beach RCP (TW-47) at Approach Beach, Castle Peak Road","","近水灣垃圾站 (TW-47)，青山公路近水灣","","近水湾垃圾站 (TW-47)，青山公路近水湾","","22.367415","114.087889","Metals,Paper,Plastics"
"1390","Accepted","Tsuen_Wan","Sham Tseng RCP (TW-62) at Sham Tseng","","深井大街垃圾收集站 (TW-62)，深井大街","","深井大街垃圾收集站 (TW-62)，深井大街","","22.367876","114.059458","Metals,Paper,Plastics"
"1391","Accepted","Tsuen_Wan","Pai Min Kok Village RCP (TW-64) at Pai Min Kok Village, Castle Peak Road","","排棉角村垃圾站 (TW-64)，青山道排棉角村","","排棉角村垃圾站 (TW-64)，青山道排棉角村","","22.365569","114.056939","Metals,Paper,Plastics"
"1392","Accepted","Tsuen_Wan","Villa Alfavista RCP (TW-65) at Castle Peak Road","","旭龍別墅垃圾站 (TW-65)，青山路","","旭龙别墅垃圾站 (TW-65)，青山路","","22.361028","114.046725","Metals,Paper,Plastics"
"1393","Accepted","Tsuen_Wan","No. 6, Route Twist RCP (TW- 77) at L/P FA5497-5 Route Twisk","","荃錦公路 6 站 (TW- 77)，荃錦公路石屎基L/P FA5497-5","","荃锦公路 6 站 (TW- 77)，荃锦公路石屎基L/P FA5497-5","","22.384117","114.108692","Metals,Paper,Plastics"
"1394","Accepted","Tsuen_Wan","Chung Kai Toi RCP (TW-79) at Castle Peak Road near Approach Beach","","松溪台垃圾站 (TW-79)，青山道近水灣側","","松溪台垃圾站 (TW-79)，青山道近水湾侧","","22.368293","114.084107","Metals,Paper,Plastics"
"1395","Accepted","Tsuen_Wan","11.5 Miles RCP (TW-84) at 11.5 Miles, Castle Peak Road","","十一咪半垃圾站 (TW-84)，青山公路十一咪半","","十一咪半垃圾站 (TW-84)，青山公路十一咪半","","22.368298","114.075851","Metals,Paper,Plastics"
"1396","Accepted","Tsuen_Wan","San Hoi Tin RCP (TW-41) at San Hoi Tin","","新開田垃圾站 (TW-41)，新開田 ","","新开田垃圾站 (TW-41)，新开田","","22.398045","114.110044","Metals,Paper,Plastics"
"1397","Accepted","Tsuen_Wan","Tung Lam Home for aged RCP(TW-32) at Tung Lam Home for aged ","","東林安老院垃圾站 (TW-32)，東林安老院 ","","东林安老院垃圾站 (TW-32)，东林安老院","","22.376590","114.119323","Metals,Paper,Plastics"
"1400","Accepted","Tsuen_Wan","Miu Kwong Street RCP (TW-8) at Miu Kwong Street","","廟崗街垃圾站 (TW-8)，廟崗街 ","","庙岗街垃圾站 (TW-8)，庙岗街","","22.371795","114.122208","Metals,Paper,Plastics"
"1401","Accepted","Tsuen_Wan","Sin Har Tung Fibreglass RCP (TW-39) at Sin Har Tung ","","仙霞洞纖維站(TW-39)，仙霞洞 ","","仙霞洞纤维站(TW-39)，仙霞洞","","22.394068","114.101939","Metals,Paper,Plastics"
"1402","Accepted","Tsuen_Wan","Near Lamp post W4946 in Amenity area near Sam Tung Uk Resite Village, Tsuen Wan ","","荃灣三楝屋村旁休憩地帶燈柱W4946旁","","荃湾三楝屋村旁休憩地带灯柱W4946旁","","22.379527","114.129185","Metals,Paper,Plastics"
"1403","Accepted","Tsuen_Wan","Yeung Uk Road Market","","楊屋道街市垃圾站 ","","杨屋道街市垃圾站","","22.368703","114.114788","Metals,Paper,Plastics"
"1404","Accepted","Central_Western","No. 78 Mount Kellet Road near Homestead Road","","加列山道78號近堪仕達道","","加列山道78号近堪仕达道","","22.264058","114.149027","Metals,Paper,Plastics"
"1405","Accepted","Central_Western","Gage Street RCP","","結志街垃圾收集站","","结志街垃圾收集站","","22.283512","114.153163","Metals,Paper,Plastics"
"1406","Accepted","Central_Western","Arbuthnot Road RCP","","亞畢諾道垃圾收集站","","亚毕诺道垃圾收集站","","22.279226","114.154614","Metals,Paper,Plastics"
"1407","Accepted","Central_Western","In front of Central MTR Station exit C at 18 Des Voeux Road Central","","德輔道中18號港鐵中環站C出口行人路前","","德辅道中18号港铁中环站C出口行人路前","","22.282237","114.157556","Metals,Paper,Plastics"
"1408","Accepted","Central_Western","Junction of Shing Wong Street & Staunton Street","","城皇街與士丹頓街交界","","城皇街与士丹顿街交界","","22.283371","114.151292","Metals,Paper,Plastics"
"1409","Accepted","Central_Western","Pavement outside 10-10A Borrett Road","","波老道10-10A號外行人路","","波老道10-10A号外行人路","","22.274470","114.162899","Metals,Paper,Plastics"
"1410","Accepted","Central_Western","Junction of Hollywood Road and Aberdeen Street","","荷李活道與鴨巴甸街交界","","荷李活道与鸭巴甸街交界","","22.283574","114.152361","Metals,Paper,Plastics"
